Venue,Rank
International Journal of Productivity and Quality Management,1
International Journal of Quality and Service Sciences,1
International Journal of Services and Operations Management,1
International Journal of Services Operations and Informatics,1
International Journal of Shipping and Transport Logistics,1
International Journal of Value Chain Management,1
Journal of Humanitarian Logistics and Supply Chain Management,1
Journal of Intelligent Manufacturing,1
Journal of Manufacturing Systems,1
Journal of Manufacturing Technology Management,1
Journal of Public Procurement,1
Journal of Quality in Maintenance Engineering,1
Journal of Service Theory and Practice,1
Knowledge and Process Management,1
Operations Management Research,1
"Proceedings of the Institution of Mechanical Engineers, Part B: Journal of Engineering Manufacture",1
Project Management Journal,1
Quality and Reliability Engineering International,1
Quality Progress,1
Service Science,1
Supply Chain Forum,1
TQM Journal,1
World Review of Intermodal Transportation Research,1
Asia-Pacific Journal of Operational Research,1
Central European Journal of Operations Research,1
Computational Management Science,1
Cybernetics and Systems,1
Decision Analysis,1
International Journal of General Systems,1
International Journal of Mathematics in Operational Research,1
International Journal of Operational Research,1
International Journal of Operations and Quantitative Management,1
International Transactions in Operational Research,1
Journal of Industrial and Management Optimization,1
Journal of Modelling in Management,1
Journal of Multi-Criteria Decision Analysis,1
Kybernetes,1
Mathematical Methods of Operations Research,1
Operational Research,1
OPSEARCH,1
Optimization,1
Pacific Journal of Optimization,1
Pesquisa Operacional,1
RAIRO - Operations Research,1
TOP,1
Action Research,1
Ephemera: Critical Dialogues on Organization,1
International Journal of Knowledge Management Studies,1
International Journal of Organization Theory and Behavior,1
International Journal of Organizational Analysis,1
International Journal of Project Organisation and Management,1
Journal of Organizational Ethnography,1
Leadership and Organization Development Journal,1
Learning Organization,1
Network Science,1
Organizations and Markets in Emerging Economies,1
Qualitative Research in Organizations and Management,1
Tamara: Journal for Critical Organization Inquiry,1
American Behavioral Scientist,1
American Journal of Psychology,1
Australian Journal of Psychology,1
Basic and Applied Social Psychology,1
Canadian Journal of Behavioural Science,1
Canadian Psychology,1
Current Psychology,1
European Psychologist,1
International Journal of Intercultural Relations,1
International Journal of Psychology,1
Japanese Psychological Research,1
Journal of Constructivist Psychology,1
Journal of Happiness Studies,1
Journal of Pacific Rim Psychology,1
Journal of Positive Psychology,1
Journal of Social Psychology,1
Nordic Psychology,1
Psicothema,1
Psihologija,1
Psychological Reports,1
Psychologist,1
Social Justice Research,1
South African Journal of Psychology,1
Spanish Journal of Psychology,1
"Community, Work and Family",1
European Work and Organizational Psychology in practice,1
Gedrag en Organisatie,1
Human Factors and Ergonomics In Manufacturing,1
Industrial and Organizational Psychology,1
International Journal for Educational and Vocational Guidance,1
International Journal of Occupational Safety and Ergonomics,1
International Negotiation,1
Journal of Career Development,1
Journal of Employment Counseling,1
Journal of Rehabilitation,1
Military Psychology,1
Occupational Medicine,1
Psychologie du Travail et des Organisations,1
Psychologist-Manager Journal,1
Rehabilitation Counseling Bulletin,1
Research in Occupational Stress and Well Being,1
Revue Europeenne de Psychologie Appliquee,1
Social Work in Public Health,1
South African Journal of Industrial Psychology,1
"Sport, Exercise, and Performance Psychology",1
The International Journal of Aerospace Psychology,1
"TPM - Testing, Psychometrics, Methodology in Applied Psychology",1
Work,1
Zeitschrift fur Arbeits- und Organisationspsychologie,1
Administrative Theory and Praxis,1
British Journal of Health Care Management,1
Health Services Management Research,1
International Journal of Educational Management,1
International Journal of Health Care Quality Assurance,1
International Journal of Health Governance,1
International Journal of Healthcare Technology and Management,1
International Journal of Public Sector Management,1
International Review of Public Administration,1
Journal of Health Organization and Management,1
Journal of Public Affairs,1
Journal of Public Affairs Education,1
Leadership in Health Services,1
Public Administration Quarterly,1
Teaching Public Administration,1
African Evaluation Journal,1
Built Environment Project and Asset Management,1
Corporate Social Responsibility and Environmental Management,1
International Journal of Energy Sector Management,1
International Journal of Housing Markets and Analysis,1
Journal of Corporate Real Estate,1
Journal of European Real Estate Research,1
Journal of Financial Management of Property and Construction,1
Journal of Geographical Systems,1
Letters in Spatial and Resource Sciences,1
Regional and Federal Studies,1
Advances in Hospitality and Leisure,1
Anatolia: An International Journal of Tourism and Hospitality Research,1
Asia Pacific Journal of Tourism Research,1
British Food Journal,1
"Digital Policy, Regulation and Governance",1
"Engineering, Construction and Architectural Management",1
Facilities,1
International Hospitality Review,1
"International Journal of Culture, Tourism and Hospitality Research",1
International Journal of Event and Festival Management,1
International Journal of Heritage Studies,1
International Journal of Hospitality and Tourism Administration,1
International Journal of Sport and Society,1
International Journal of Sport Finance,1
International Journal of Sport Management,1
International Journal of Sport Management and Marketing,1
International Journal of Sport Policy and Politics,1
International Journal of Sports Marketing and Sponsorship,1
Journal of China Tourism Research,1
Journal of Convention and Event Tourism,1
Journal of Destination Marketing and Management,1
Journal of Ecotourism,1
Journal of Foodservice Business Research,1
Journal of Hospitality and Tourism Education,1
Journal of Hospitality and Tourism Technology,1
Journal of Hospitality Marketing and Management,1
"Journal of Hospitality, Leisure, Sport and Tourism Education",1
Journal of Human Resources in Hospitality and Tourism,1
Journal of Media Business Studies,1
Journal of Outdoor Recreation and Tourism,1
"Journal of Policy Research in Tourism, Leisure and Events",1
Journal of Quality Assurance in Hospitality and Tourism,1
Journal of Sport and Tourism,1
Journal of the Textile Institute,1
Journal of Vacation Marketing,1
Managing Leisure: An International Journal,1
Marine Resource Economics,1
Maritime Economics and Logistics,1
Non-Profit Management & Leadership,1
Nutrition and Food Science,1
PASOS Journal of Tourism and Cultural Heritage,1
Property Management,1
Service Business,1
Sport Marketing Quarterly,1
"Sport, Business and Management: An International Journal",1
Telecommunications Policy,1
Tourism Review,1
"Tourism, Culture and Communication",1
Utilities Policy,1
Visitor Studies,1
World Leisure Journal,1
Worldwide Hospitality and Tourism Themes,1
Area,1
Asia Europe Journal,1
Environmental Economics,1
Ethnic and Racial Studies,1
Geographical Journal,1
"International Journal of Law, Crime and Justice",1
International Journal of Sociology and Social Policy,1
International Migration Review,1
Journal of Globalization and Development,1
Journal of International Studies,1
Journal of Leadership Studies,1
Journal of Studies in International Education,1
Journal of Trust Research,1
Management of Environmental Quality,1
Policy Sciences,1
Population Studies,1
Review of European Studies,1
Studies in Indian Politics,1
Transactions of the Institute of British Geographers,1
Valuation Studies,1
Foresight,1
International Journal of Strategic Decision Sciences,1
Journal of Business Models,1
Journal of Business Strategy,1
Journal of Change Management,1
Journal of Strategic Contracting and Negotiation,1
Journal of Strategy and Management,1
M@n@gement,1
Management Review Quarterly,1
Strategy and Leadership,1
